{"type":"config","name":"lifted-pdb-projection-build","metricName":"projection_ms","metricUnit":"ms","bestDirection":"lower"}
{"run":1,"commit":"484e548","metric":9240.9962,"samples":[9240.9962,9340.6558,9163.4390],"confidence":null,"status":"keep","description":"baseline","timestamp":1781138056,"segment":0}
{"run":2,"commit":"d32067d","metric":2751.6105,"samples":[2751.6105,2730.1232,2794.2747],"metrics":{"blocksworld_ms":1004.6163,"visitall_ms":1134.6205,"labyrinth_ms":483.6033,"childsnack_ms":112.8512,"genome_ms":58.5834},"confidence":136.459,"status":"keep","description":"dedup substitutions via hash set instead of O(n^2) any_of+EqualTo","timestamp":1781139222,"segment":0}
{"run":3,"commit":"48a8cd1","metric":2271.3829,"samples":[2342.7433,2271.3829,2262.7990],"metrics":{"blocksworld_ms":819.1732,"visitall_ms":838.5969,"labyrinth_ms":453.8686,"childsnack_ms":98.9943,"genome_ms":52.1660},"confidence":21.54,"status":"keep","description":"share immutable SubstitutionFunction domain via shared_ptr across copies","timestamp":1781139948,"segment":0}
{"run":4,"commit":"a14edd9","metric":1926.0943,"samples":[1926.0943,1929.4836,1910.5904],"metrics":{"blocksworld_ms":698.6652,"visitall_ms":691.6468,"labyrinth_ms":371.6522,"childsnack_ms":98.0365,"genome_ms":50.5897},"confidence":38.9,"status":"keep","description":"apply_substitution_fixpoint fast path avoids seen-vector alloc","timestamp":1781140649,"segment":0}
{"run":5,"commit":"c213312","metric":1888.6748,"samples":[1862.3161,1888.7582,1888.6748],"metrics":{"blocksworld_ms":671.9425,"visitall_ms":705.6907,"labyrinth_ms":369.0001,"childsnack_ms":93.5970,"genome_ms":48.4445},"confidence":14.536,"status":"keep","description":"hoist MutableAction/sigma0/pds out of src-state loop","timestamp":1781140972,"segment":0}
{"type":"config","name":"lifted-pdb-projection-build-geomean","metricName":"projection_geomean_ms","metricUnit":"ms","bestDirection":"lower","note":"segment 1: geometric mean over all 9 HTG domain families; >=10s tasks"}
{"run":1,"commit":"484e548","metric":null,"samples":[],"status":"crash","description":"baseline (no opts): blocksworld-500 exceeds 600s at O(n^2) substitution dedup -> suite intractable. run2 makes it tractable.","timestamp":1781174918,"segment":1}
{"run":2,"commit":"d32067d","metric":23100.2763,"samples":[23686.5163,23100.2763,22915.3642],"status":"keep","description":"[rerun] hash-set substitution dedup; first all-9-domain-completing point","timestamp":1781174918,"segment":1}
{"run":3,"commit":"48a8cd1","metric":20894.9764,"samples":[21016.4478,20482.1862,20894.9764],"status":"keep","description":"[rerun] shared SubstitutionFunction domain","timestamp":1781174918,"segment":1}
{"run":4,"commit":"a14edd9","metric":18757.9748,"samples":[18919.6083,18757.9748,18506.0193],"status":"keep","description":"[rerun] apply_substitution_fixpoint fast path","timestamp":1781174918,"segment":1}
{"run":5,"commit":"c213312","metric":18492.4491,"samples":[18745.4638,18265.6922,18492.4491],"metrics":{"blocksworld_ms":21270.70,"childsnack_ms":14956.95,"visitall_ms":9408.92,"labyrinth_ms":2998.23,"logistics_ms":84511.47,"organic_ms":2707.86,"pipesworld_ms":67243.30,"rovers_ms":102208.41,"genome_ms":17916.12},"status":"keep","description":"[rerun] hoist per-action invariants; CURRENT BEST (geomean over 9 domains)","timestamp":1781174918,"segment":1}
{"run":6,"commit":"15461fa","metric":11124.0102,"samples":[11120.7111,11140.2841,11124.0102],"metrics":{"blocksworld_ms":22319.34,"childsnack_ms":10719.96,"visitall_ms":9943.75,"labyrinth_ms":2516.38,"logistics_ms":12833.21,"organic_ms":2707.86,"pipesworld_ms":58311.31,"rovers_ms":12338.96,"genome_ms":21119.58},"confidence":507.84,"status":"keep","description":"O(1) hash membership for ground static literals in join_static_v2","timestamp":1781179455,"segment":1}
{"run":7,"commit":"db98fde","metric":9707.3174,"samples":[9694.0485,9791.7326,9707.3174],"status":"keep","description":"O(1) arithmetic position lookup for contiguous substitution domains (no m_positions hash)","timestamp":1781182842,"segment":1}
{"run":8,"commit":"db98fde","metric":9724.9039,"samples":[9673.1917,9724.9039,9736.8653],"confidence":0.94,"status":"discard","description":"effect-params trail (mutate+undo instead of sigma copy): no improvement; effect_param_enums too small to matter","timestamp":1781187990,"segment":1}
{"run":9,"commit":"28c77f8","metric":9228.9392,"samples":[9214.3044,9240.2292,9228.9392],"metrics":{"blocksworld_ms":17574.60,"childsnack_ms":9492.01,"visitall_ms":7966.55,"labyrinth_ms":1942.48,"logistics_ms":9998.32,"organic_ms":2316.41,"pipesworld_ms":39661.08,"rovers_ms":9807.24,"genome_ms":20659.02},"confidence":26.28,"status":"keep","description":"match-in-place: avoid literal materialization on non-ground match path","timestamp":1781192978,"segment":1}
{"run":10,"commit":"28c77f8","metric":null,"samples":[],"status":"crash","description":"match-level trail (in-place match_in_place + undo in fluent/static join): HANGS on organic-synthesis-alkene (>90s, was 2.4s) but is a BIG win elsewhere (visitall 7966->4953, childsnack 9492->7435, labyrinth 1942->1769). Organic-specific match_in_place divergence not yet found; predicate/arity guard added but insufficient. Reverted.","timestamp":1781198641,"segment":1}
{"type":"note","about_run":10,"timestamp":1781200130,"segment":1,"note":"CORRECTION: organic 'hang' was environmental (shared node load ~13 slowed PARSING+PATTERN-GEN; organic projection build itself is only ~2478ms, process wall ~293s). run10 trail revert likely premature; trail is a promising big win. Re-evaluate on a quiet node with long per-task timeout, reading PROJ_MS."}
{"run":11,"commit":"aae4644","metric":7911.5030,"samples":[7911.5030,7878.9319,7923.5769],"metrics":{"blocksworld_ms":15569.59,"childsnack_ms":7384.40,"visitall_ms":4940.43,"labyrinth_ms":1752.37,"logistics_ms":8553.21,"organic_ms":2220.08,"pipesworld_ms":36803.52,"rovers_ms":8497.65,"genome_ms":20542.94},"confidence":76.07,"status":"keep","description":"trail-based in-place unification (match_in_place); re-applied after run10 false revert (node-load, not a bug). measured under node load ~10, still -14%","timestamp":1781206954,"segment":1}
{"run":12,"commit":"4ef995d","metric":7645.1140,"samples":[7590.3985,7645.1140,7666.2655],"metrics":{"childsnack_ms":7075.38,"visitall_ms":4816.79,"labyrinth_ms":1727.65,"logistics_ms":8464.21,"organic_ms":2126.36,"pipesworld_ms":36153.81,"rovers_ms":8092.54,"genome_ms":19666.07},"confidence":10.82,"status":"keep","description":"trail-based effect-param enumeration (N1); measured under node load","timestamp":1781210386,"segment":1}
{"run":13,"commit":"0d6d3e0","metric":6902.3789,"samples":[6942.5541,6914.5960,6902.3789],"metrics":{"childsnack_ms":6876.17,"visitall_ms":4308.82,"labyrinth_ms":1516.64,"logistics_ms":6903.71,"organic_ms":2076.45,"pipesworld_ms":29090.36,"rovers_ms":7258.68,"genome_ms":20289.51},"confidence":29.53,"status":"keep","description":"resolve atoms into reused scratch in apply_effect_to_mask + verify_pattern_preconditions (N2); pipesworld -20%","timestamp":1781212426,"segment":1}
{"run":14,"commit":"ae1078e","metric":5209.1348,"samples":[5209.1348,5130.7415,5285.1443],"metrics":{"childsnack_ms":6782.91,"visitall_ms":4253.17,"labyrinth_ms":1492.69,"logistics_ms":6735.86,"organic_ms":374.36,"pipesworld_ms":28677.52,"rovers_ms":6476.33,"genome_ms":13052.92},"confidence":57.27,"status":"keep","description":"lazy axiom/action/rpg datalog program construction in Task<LiftedTag> (subsystem fix: 150 redundant program builds per task eliminated)","timestamp":1781216836,"segment":1}
{"run":15,"commit":"9d0315c","metric":4666.5177,"samples":[4646.0053,4712.7847,4666.5177],"metrics":{"childsnack_ms":6558.80,"visitall_ms":3408.97,"labyrinth_ms":1333.72,"logistics_ms":5648.88,"organic_ms":376.43,"pipesworld_ms":23329.40,"rovers_ms":5635.01,"genome_ms":12327.80},"confidence":10.96,"status":"keep","description":"linear-scan PatternBitIndex replaces hashed atom->bit map (pipesworld push)","timestamp":1781222638,"segment":1}
{"run":16,"commit":"97c6e9e","metric":3994.1084,"samples":[3974.3250,4030.2853,3994.1084],"metrics":{"childsnack_ms":4337.55,"visitall_ms":2971.79,"labyrinth_ms":1233.06,"logistics_ms":5495.86,"organic_ms":343.25,"pipesworld_ms":23892.35,"rovers_ms":5693.95,"genome_ms":6451.20},"confidence":22.51,"status":"keep","description":"task-level R+ memo: pattern gen + projection gen share one fixpoint (genome push)","timestamp":1781224658,"segment":1}
{"run":17,"commit":"830f4fe","metric":541.5668,"samples":[540.5532,544.6363,541.5668],"metrics":{"childsnack_ms":620.63,"visitall_ms":13.82,"labyrinth_ms":32.44,"logistics_ms":210.69,"organic_ms":488.12,"pipesworld_ms":8565.70,"rovers_ms":596.97,"genome_ms":6566.46},"confidence":1140.66,"status":"keep","description":"ALGORITHMIC: early self-loop subtree pruning via anti-monotone effect feasibility (-86% geomean)","timestamp":1781248169,"segment":1}
{"type":"config","name":"lifted-pdb-projection-build-geomean-v2","metricName":"projection_geomean_ms","metricUnit":"ms","bestDirection":"lower","note":"segment 2: suite recalibrated post run-17 (harder instances); algorithmic focus"}
{"run":1,"commit":"830f4fe","metric":5444.1120,"samples":[5350.5803,5444.1120,5490.1410],"metrics":{"blocksworld_ms":16413.8769,"childsnack_ms":4270.72,"visitall_ms":1236.05,"labyrinth_ms":473.16,"logistics_ms":14463.95,"organic_ms":542.66,"pipesworld_ms":51741.03,"rovers_ms":34597.51,"genome_ms":7866.78},"status":"keep","description":"segment-2 baseline at run-17 code, recalibrated suite","timestamp":1781256821,"segment":2}
{"run":2,"commit":"faafa28","metric":5113.2989,"samples":[5339.5251,5113.2989,4879.4160],"metrics":{"childsnack_ms":3226.42,"visitall_ms":1195.97,"labyrinth_ms":451.74,"logistics_ms":13317.08,"organic_ms":485.44,"pipesworld_ms":42496.42,"rovers_ms":30184.96,"genome_ms":7062.13},"confidence":3.20,"status":"keep","description":"S1: lazily-built static hash-join on runtime bound-position mask","timestamp":1781261221,"segment":2}
{"run":3,"commit":"faafa28","metric":null,"samples":[4463.2669,4679.9511,4828.1422,5209.3199,5908.5613,5009.4507],"confidence":0.56,"status":"discard","description":"S2 incremental feasibility: pooled within noise. LOAD-CONFOUNDED: node load rose 10->44-48 between runs; S2 is logically strictly-less-work (same pruning, fewer checks) — RETRY ON QUIET NODE rather than abandon.","timestamp":1781267584,"segment":2}
{"run": 4, "commit": "c6564f5", "metric": 4535.8875, "samples": [4555.1676, 4535.8875, 4434.683], "metrics": {"blocksworld_ms": 14549.05, "childsnack_ms": 2877.04, "visitall_ms": 1124.39, "labyrinth_ms": 425.17, "logistics_ms": 11820.14, "organic_ms": 409.38, "pipesworld_ms": 38100.69, "rovers_ms": 27476.71, "genome_ms": 6544.14}, "confidence": 16.922, "status": "keep", "description": "S2 RETRY (load-matched quiet-node A/B): incremental self-loop feasibility checks at binding sites only (effect_param_mask) + root check. -5.4% vs run-2 baseline re-measured in same window; resolves the seg2-run3 load-confounded discard. Sigs + checks OK.", "timestamp": 1781306841, "segment": 2}
